{
  "$schema": "https://json-schema.org/draft/2020-12/schema",
  "$id": "https://alphafrog.local/schemas/beta/manifest.schema.json",
  "title": "AlphaFrog Beta deployment manifest",
  "description": "Desired services for one isolated Beta traffic scope. Runtime file: /var/lib/alphafrog-beta/deployments/<deployment-id>/manifest.json.",
  "$comment": "The controller MUST enable Draft 2020-12 format assertions for date-time. Treating format as annotation is not conforming.",
  "type": "object",
  "additionalProperties": false,
  "required": [
    "schemaVersion",
    "deploymentId",
    "trafficScopeId",
    "manifestVersion",
    "gitCommit",
    "owner",
    "createdAt",
    "expiresAt",
    "services"
  ],
  "properties": {
    "schemaVersion": {
      "const": 1
    },
    "deploymentId": {
      "$ref": "#/$defs/deploymentId"
    },
    "trafficScopeId": {
      "$ref": "#/$defs/trafficScopeId"
    },
    "manifestVersion": {
      "type": "integer",
      "minimum": 1,
      "maximum": 9007199254740991
    },
    "gitCommit": {
      "type": "string",
      "pattern": "^[a-f0-9]{40}$"
    },
    "owner": {
      "$ref": "#/$defs/owner"
    },
    "createdAt": {
      "$ref": "#/$defs/timestamp"
    },
    "expiresAt": {
      "$ref": "#/$defs/timestamp"
    },
    "services": {
      "type": "array",
      "minItems": 1,
      "items": {
        "$ref": "#/$defs/serviceSpec"
      }
    }
  },
  "$defs": {
    "deploymentId": {
      "type": "string",
      "minLength": 3,
      "maxLength": 64,
      "pattern": "^(?!stable$)[a-z0-9](?:[a-z0-9-]{1,62}[a-z0-9])$"
    },
    "trafficScopeId": {
      "type": "string",
      "minLength": 1,
      "maxLength": 96,
      "pattern": "^(?!stable$)[a-z0-9](?:[a-z0-9._-]{0,94}[a-z0-9])?$"
    },
    "serviceName": {
      "type": "string",
      "minLength": 1,
      "maxLength": 96,
      "pattern": "^[a-z][a-z0-9-]*$"
    },
    "dubboServiceKey": {
      "type": "string",
      "minLength": 3,
      "maxLength": 512,
      "pattern": "^(?:[0-9A-Za-z._-]+/)?[A-Za-z_$][A-Za-z0-9_$]*(?:\\.[A-Za-z_$][A-Za-z0-9_$]*)*(?::[0-9A-Za-z._-]+)?$"
    },
    "opaqueId": {
      "type": "string",
      "minLength": 1,
      "maxLength": 128,
      "pattern": "^[A-Za-z0-9][A-Za-z0-9._:-]{0,127}$"
    },
    "nacosText": {
      "type": "string",
      "minLength": 1,
      "maxLength": 256,
      "pattern": "^(?=.*\\S)[^\\u0000-\\u001f\\u007f-\\u009f]+$"
    },
    "sha256": {
      "type": "string",
      "pattern": "^[a-f0-9]{64}$"
    },
    "imageId": {
      "type": "string",
      "pattern": "^sha256:[a-f0-9]{64}$"
    },
    "timestamp": {
      "type": "string",
      "format": "date-time",
      "pattern": "Z$"
    },
    "port": {
      "type": "integer",
      "minimum": 1,
      "maximum": 65535
    },
    "owner": {
      "type": "object",
      "additionalProperties": false,
      "required": [
        "ownerId"
      ],
      "properties": {
        "ownerId": {
          "$ref": "#/$defs/opaqueId"
        }
      }
    },
    "serviceSpec": {
      "type": "object",
      "additionalProperties": false,
      "required": [
        "serviceName",
        "dubboServiceKey",
        "releaseId",
        "serviceSpecSha256",
        "machineId",
        "image",
        "runtime"
      ],
      "properties": {
        "serviceName": {
          "$ref": "#/$defs/serviceName"
        },
        "dubboServiceKey": {
          "$ref": "#/$defs/dubboServiceKey"
        },
        "releaseId": {
          "$ref": "#/$defs/opaqueId"
        },
        "serviceSpecSha256": {
          "$ref": "#/$defs/sha256"
        },
        "machineId": {
          "$ref": "#/$defs/opaqueId"
        },
        "image": {
          "$ref": "#/$defs/image"
        },
        "runtime": {
          "$ref": "#/$defs/runtime"
        },
        "registration": {
          "$ref": "#/$defs/registrationTemplate"
        },
        "environmentOverrides": {
          "type": "object",
          "propertyNames": {
            "pattern": "^[A-Za-z_][A-Za-z0-9_]*$"
          },
          "additionalProperties": {
            "type": "string"
          }
        },
        "bindMounts": {
          "type": "array",
          "items": {
            "type": "object",
            "additionalProperties": false,
            "required": ["key", "source", "target", "mode"],
            "properties": {
              "key": {
                "type": "string",
                "pattern": "^[a-z][a-z0-9-]{0,62}$"
              },
              "source": {
                "type": "string",
                "pattern": "^/[^:\\u0000-\\u001f\\u007f]*$"
              },
              "target": {
                "type": "string",
                "pattern": "^/[^:\\u0000-\\u001f\\u007f]*$"
              },
              "mode": {
                "enum": ["ro", "rw"]
              },
              "env": {
                "type": "string",
                "pattern": "^[A-Za-z_][A-Za-z0-9_]*$"
              }
            }
          }
        },
        "runtimeConfigSha256": {
          "anyOf": [
            {
              "$ref": "#/$defs/sha256"
            },
            {
              "type": "null"
            }
          ],
          "default": null
        }
      }
    },
    "image": {
      "type": "object",
      "additionalProperties": false,
      "required": [
        "repositoryDigest",
        "localImageId"
      ],
      "properties": {
        "repositoryDigest": {
          "type": "string",
          "minLength": 3,
          "maxLength": 512,
          "pattern": "^(?:[^\\s@]+@sha256:[a-f0-9]{64}|(?:(?:[a-z0-9](?:[a-z0-9.-]*[a-z0-9])?|localhost)(?::[0-9]{1,5})?/)?[a-z0-9]+(?:(?:[._]|__|[-]+)[a-z0-9]+)*(?:/[a-z0-9]+(?:(?:[._]|__|[-]+)[a-z0-9]+)*)*:[A-Za-z0-9_][A-Za-z0-9_.-]{0,127})$"
        },
        "localImageId": {
          "$ref": "#/$defs/imageId"
        }
      }
    },
    "runtime": {
      "type": "object",
      "additionalProperties": false,
      "required": [
        "containerPort",
        "hostPorts",
        "healthCheckProfile",
        "readinessTimeoutSeconds",
        "shutdownProfile",
        "applicationDrainSeconds",
        "drainGraceSeconds"
      ],
      "properties": {
        "containerPort": {
          "$ref": "#/$defs/port"
        },
        "hostPorts": {
          "type": "array",
          "minItems": 2,
          "maxItems": 2,
          "uniqueItems": true,
          "items": {
            "$ref": "#/$defs/port"
          }
        },
        "healthCheckProfile": {
          "const": "CONTROLLER_TCP_V1"
        },
        "readinessTimeoutSeconds": {
          "type": "integer",
          "minimum": 1,
          "maximum": 3600
        },
        "shutdownProfile": {
          "enum": [
            "SPRING_BOOT_HTTP_DUBBO_V1",
            "SPRING_BOOT_DUBBO_V1",
            "SPRING_BOOT_HTTP_V1"
          ]
        },
        "applicationDrainSeconds": {
          "type": "integer",
          "minimum": 6,
          "maximum": 86395
        },
        "drainGraceSeconds": {
          "type": "integer",
          "minimum": 1,
          "maximum": 86400
        },
        "allowToolJobProcessHalt": {
          "type": "boolean",
          "default": false,
          "description": "Only an isolated Agent lane may turn a one-shot tool-job fault record into a process halt."
        }
      }
    },
    "registrationTemplate": {
      "type": "object",
      "additionalProperties": false,
      "required": [
        "serviceName",
        "groupName",
        "namespaceId",
        "clusterName",
        "applicationName"
      ],
      "properties": {
        "serviceName": {
          "$ref": "#/$defs/nacosText"
        },
        "groupName": {
          "const": "alphafrog-beta"
        },
        "namespaceId": {
          "$ref": "#/$defs/nacosText"
        },
        "clusterName": {
          "type": "string",
          "pattern": "^[0-9A-Za-z-]+$",
          "maxLength": 128
        },
        "applicationName": {
          "$ref": "#/$defs/nacosText"
        }
      }
    }
  }
}
